ID,Programme Name,Method,Duration,ALTI Name,Issuer,Phone,Email,Web
100,Certified in Risk and Information Systems Control (CRISC),Hybrid,4 Days,Inovasi Edutech M Sdn Bhd,Information Systems Audit and Control Association (ISACA),60379550315,hello@inotech.my,https://www.inotech.my
101,Certified Information Systems Auditor (CISA),Hybrid,5 Days,Inovasi Edutech M Sdn Bhd,Information Systems Audit and Control Association (ISACA),60379550315,hello@inotech.my,https://www.inotech.my
102,Certified in The Governance of Enterprise IT (CGEIT),Hybrid,4 Days,Inovasi Edutech M Sdn Bhd,Information Systems Audit and Control Association (ISACA),60379550315,hello@inotech.my,https://www.inotech.my
103,Certified Data Privacy Solutions Engineer (CDPSE),Hybrid,3 Days,Inovasi Edutech M Sdn Bhd,Information Systems Audit and Control Association (ISACA),60379550315,hello@inotech.my,https://www.inotech.my
104,Generative AI Foundations,"Online, Hybrid, Physical",2 Days,Nitkertz (Malaysia) Sdn Bhd,PEARSON,60188744353,admin@nitkertz.com.my,http://www.nitkertzacademy.edu.my
105,Society for Human Resource Management (SHRM) Certified Professional (SHRM-CP),Hybrid,1 Year,Noesis Exed Sdn Bhd,Society for Human Resource Management (SHRM),60327254291,info@noesis.edu.sg,https://noesis.edu.sg/
